{
  "schemaVersion": 1,
  "renderer": "androdash/0.1.0",
  "generatedAt": "2026-10-26T12:00:10.120Z",
  "startedAt": "2026-10-26T12:00:00.000Z",
  "config": {
    "schemaVersion": 1,
    "dashboardUrl": "http://10.0.2.2:8099/contracts/fixtures/demo-dashboard.json",
    "prometheusUrl": "http://10.0.2.2:9091",
    "refreshSeconds": 10,
    "timeRange": "15m",
    "stepSeconds": null,
    "kiosk": true,
    "debug": true,
    "layoutMode": "auto",
    "dashboardName": null,
    "capabilities": null,
    "showUnsupported": false
  },
  "capabilities": {
    "advertised": ["prometheus"],
    "unknown": [],
    "probed": [
      {
        "baseUrl": "http://10.0.2.2:9091",
        "ok": true,
        "version": "2.53.0-androdash-mock",
        "latencyMs": 12,
        "error": null
      }
    ]
  },
  "dashboard": {
    "url": "http://10.0.2.2:8099/contracts/fixtures/demo-dashboard.json",
    "name": "AndroDash Demo",
    "duration": "15m",
    "refreshInterval": "10s",
    "panelsTotal": 9,
    "rowsTotal": 4
  },
  "panels": {
    "total": 9,
    "rendered": 6,
    "hidden": 3,
    "errors": 0,
    "hiddenReasons": [
      {
        "panelId": "logs",
        "panelKind": "LogsTable",
        "reason": "unsupported_query",
        "detail": "LokiLogQuery"
      },
      {
        "panelId": "traces",
        "panelKind": "TraceTable",
        "reason": "unsupported_query",
        "detail": "TempoTraceQuery"
      },
      {
        "panelId": "unknown",
        "panelKind": "FancyChart",
        "reason": "unsupported_panel",
        "detail": "FancyChart"
      }
    ]
  },
  "lastRefresh": {
    "startedAt": "2026-10-26T12:00:10.000Z",
    "endedAt": "2026-10-26T12:00:10.120Z",
    "ok": true,
    "durationMs": 120,
    "succeeded": 6,
    "failed": 0
  },
  "nextRefreshAt": "2026-10-26T12:00:20.120Z",
  "requests": [
    {
      "at": "2026-10-26T12:00:10.020Z",
      "method": "GET",
      "url": "http://10.0.2.2:9091/api/v1/query_range",
      "status": 200,
      "durationMs": 12
    }
  ],
  "errors": [],
  "warnings": []
}
